BBC_Title,Alj_Title,Similarity,BBC_date,Alj_date,BBC_text,Alj_text
Who was Hamas leader Saleh al-Arouri killed in Beirut?,"Who was Saleh al-Arouri, the Hamas leader killed in Beirut?",0.9779724266914104,2024-01-02,2024-01-03,"Saleh al-Arouri was one of the most senior figures in the Hamas hierarchy - a leading man on both the political and military fronts. The 57-year-old was the deputy head of Hamas's political bureau, and helped establish the group's military wing, the Izzedine al-Qassam Brigades.He had remained deeply involved with the group's military affairs.He was killed in an explosion in Beirut's southern suburb of Dahiyeh, an attack widely blamed on Israel.Saleh al-Arouri joined Hamas in 1987, and helped establish the group's military presence in the occupied West Bank.He was one of the closest connected Hamas officials to both Iran and Iran-backed Hezbollah in Lebanon. He had served time in Israeli prisons. After his release he was a negotiator in a deal that saw more than 1,000 Palestinian prisoners being released in return for the freeing of Israeli soldier Gilad Shalit in 2011.On 27 October this year the Israeli army had demolished his West Bank home in the town of Arura, near Ramallah. Arouri was living in Lebanon at the time of his death.Lebanese media reported that he was killed in an Israeli drone attack on Hamas's office in the southern Beirut suburb of Dahiyeh, alongside six others who were reported to have also been members of Hamas. This is not just about who was killed but where he was killed. A senior Hamas official killed in a Hezbollah stronghold in Lebanon is bound to make things even more precarious at a very volatile junction in the fighting.Lebanon's caretaker Prime Minister Najib Mikati described the killing as a new Israeli war crime that aimed to drag Lebanon into a new phase of the conflict.Hezbollah called the attack a ""serious assault on Lebanon, its people, its security, [and] sovereignty"" and warned that ""this crime will never pass without response and punishment"".Izzat Al-Rishq, a member of the Hamas Political bureau called it a ""cowardly assassination by the Zionist occupation"". Israel's military has not commented, telling the BBC it does not respond to reports in foreign media. Israel is widely reported to commit targeted killings on foreign soil, but rarely comments on cross-border strikes. Mark Regev, adviser to Israeli Prime Minister Benjamin Netanyahu, did not say that Israel was responsible but called the attack a ""surgical strike"" against Hamas's leadership.The country and the wider region now faces an anxious wait to see how Hezbollah reacts, and whether Israel's war in Gaza spills over into Lebanon.","A drone strike in Beirut’s southern suburbs of Dahiyeh, a Hezbollah stronghold, killed senior Hamas official Saleh al-Arouri on Tuesday. The drone hit a Hamas office, leaving six people dead, Lebanon’s state news agency reported. Hamas confirmed the death of al-Arouri and called it a “cowardly assassination” by Israel, adding that attacks on Palestinians “inside and outside Palestine will not succeed in breaking the will and steadfastness of our people, or undermining the continuation of their valiant resistance”. “It proves once again the abject failure of this enemy to achieve any of its aggressive goals in the Gaza Strip,” the group said. Following the news of the death of al-Arouri, mosques in Arura, the occupied West Bank town of north Ramallah, are mourning his death and a general strike has been called in Ramallah for Wednesday. Here is what to know about the Hamas official killed in Lebanon. Al-Arouri, 57, was the deputy chief of Hamas’s political bureau and one of the founders of the group’s armed wing, the Qassam Brigades. He had been living in exile in Lebanon after spending 15 years in an Israeli jail. Before the war began on October 7, Israeli Prime Minister Benjamin Netanyahu had threatened to kill him. In recent weeks, al-Arouri took on the role of spokesperson for the group and told Al Jazeera last month that Hamas would not discuss an exchange deal for the captives the group is holding before the war ends in Gaza. The United States labelled al-Arouri as a “global terrorist” in 2015 and issued a $5m reward for any information on him. While there has been no official response from Israel about the death of the Hamas official, Mark Regev, an adviser to Netanyahu, told the US outlet MSNBC that Israel does not take responsibility for this attack. But, added, “Whoever did it, it must be clear: this was not an attack on the Lebanese state.” “Whoever did this did a surgical strike against the Hamas leadership,” he said. However, Danny Danon, a former Israeli envoy to the United Nations, hailed the attack and congratulated the Israeli army, Shin Bet, the security service and Mossad, Israel’s intelligence agency, for killing al-Arouri. “Anyone who was involved in the 7/10 massacre should know that we will reach out to them and close an account with them,” he said on X in Hebrew, referring to the October 7 Hamas attack on southern Israel that killed nearly 1,200 people. Israel’s relentless bombing and artillery shelling of Gaza since then has killed more than 22,000 Palestinians, including more than 8,000 children. According to Israeli media, the government has ordered cabinet ministers not to give any interviews about al-Arouri’s death after Danon’s tweet. Lebanon’s caretaker Prime Minister Najib Mikati condemned the attack on the Beruit suburb and said it was a “new Israeli crime” as well as an attempt to pull Lebanon into the war. Mikati also warned against the “Israeli political upper echelon resorting to exporting its failures in Gaza to the southern border to impose new facts on the ground and change the rules of engagement”. Hezbollah said that the attack on Lebanon’s capital “will not pass without punishment”."
South Africa files ICJ case accusing Israel of 'genocidal acts',South Africa files case at ICJ accusing Israel of ‘genocidal acts’ in Gaza,0.9613096302063819,2023-12-29,2023-12-29,"South Africa has filed a case at the International Court of Justice (ICJ) alleging that Israel is engaging in ""genocidal acts"" in Gaza.The UN court confirmed the application concerning alleged violations of Israel's obligations under the Genocide Convention.Israel has strongly rejected the allegation, calling it ""baseless"".""Israel rejects with disgust the blood libel spread by South Africa"", the foreign ministry said.The ICJ, which is based in the Hague in the Netherlands, is the UN's principal judicial organ. It settles disputes between states and gives advisory opinions on international legal issues.Following its application to the ICJ, South Africa's presidency said in a statement that the country was obliged ""to prevent genocide from occurring"".""South Africa is gravely concerned with the plight of civilians caught in the present Israeli attacks on the Gaza Strip due to the indiscriminate use of force and forcible removal of inhabitants,"" it said.""Furthermore, there are ongoing reports of international crimes, such as crimes against humanity and war crimes, being committed as well as reports that acts meeting the threshold of genocide or related crimes... have been and may still be committed in the context of the ongoing massacres in Gaza.""The 84-page document states that the ""acts and omissions by Israel"" are ""genocidal in character because they are intended to bring about the destruction of a substantial part of the Palestinian national, racial and ethnical group"".The application asks the ICJ for a hearing to take place next week and requests that a number ""provisional measures"" be indicated by the court, including that Israel cease all military activities in Gaza.Lior Haiat, a spokesman for Israel's foreign affairs ministry, said South Africa's claim ""constitutes despicable and contemptuous exploitation of the Court.""He said South Africa was ""cooperating with a terrorist organisation that is calling for the destruction of the State of Israel"" and said Hamas was ""responsible for the suffering of the Palestinians in the Gaza Strip by using them as human shields and stealing humanitarian aid from them"".""Israel is committed to international law and acts in accordance with it, and directs its military efforts only against the Hamas terrorist organization and the other terrorist organizations cooperating with Hamas,"" Mr Haiat said.""Israel has made it clear that the residents of the Gaza Strip are not the enemy, and is making every effort to limit harm to the non-involved and to allow humanitarian aid to enter the Gaza Strip.""South Africa has been highly critical of Israel's military operation in Gaza.In early November, it recalled all of its diplomats from Israel. Israel, in turn, recalled its ambassador from Pretoria.In addition, the South African national assembly voted to suspend all diplomatic relations with Israel, but the government has not yet formally responded to the vote.South Africa previously filed a referral to a different court, the International Criminal Court (ICC), relating to alleged war crimes by Israel in Gaza. The ICC â€‹investigates and tries individuals charged with genocide, war crimes, and crimes against humanity. Israel does not recognise the ICC.The current war between Israel and Hamas was triggered by the 7 October Hamas attack on southern Israel, which killed about 1,200 people - most of them civilians - and saw about 240 others taken hostage.More than 21,500 people have been killed in Gaza - mostly children and women - during Israeli retaliatory attacks on Gaza, according to the Hamas-run health ministry.","South Africa has filed a case against Israel at the International Court of Justice (ICJ), accusing it of crimes of genocide against Palestinians in Gaza after nearly three months of relentless Israeli bombardment has killed more than 21,500 people and caused widespread destruction in the besieged enclave. In an application to the court on Friday, South Africa described Israel’s actions in Gaza as “genocidal in character because they are intended to bring about the destruction of a substantial part of the Palestinian national, racial and ethnical group”. “The acts in question include killing Palestinians in Gaza, causing them serious bodily and mental harm, and inflicting on them conditions of life calculated to bring about their physical destruction,” the application said. The ICJ, also called the World Court, is a UN civil court that adjudicates disputes between countries. It is distinct from the International Criminal Court (ICC), which prosecutes individuals for war crimes. As members of the UN, both South Africa and Israel are bound by the court. South African President Cyril Ramaphosa has compared Israel’s policies in Gaza and the occupied West Bank with his country’s past apartheid regime of racial segregation imposed by the white-minority rule that ended in 1994. Several human rights organisations have said that Israeli policies towards Palestinians amount to apartheid. PRESS RELEASE:#SouthAfricainstitutes proceedings against#Israeland asks the#ICJto indicate provisional measureshttps://t.co/WedDXvtBD4pic.twitter.com/VCCDyORrLy — CIJ_ICJ (@CIJ_ICJ)December 29, 2023  South Africa said Israel’s conduct, particularly since the war began on October 7, violates the UN’s Genocide Convention, and called for an expedited hearing. The application also requests the court to indicate provisional measures to “protect against further, severe and irreparable harm to the rights of the Palestinian people” under the Convention. “South Africa is gravely concerned with the plight of civilians caught in the present Israeli attacks on the Gaza Strip due to the indiscriminate use of force and forcible removal of inhabitants,” a statement from South Africa’s Department of International Relations and Cooperation (DIRCO) said, adding that the country has “repeatedly stated that it condemns all violence and attacks against all civilians, including Israelis.”    “South Africa has continuously called for an immediate and permanent ceasefire and the resumption of talks that will end the violence arising from the continued belligerent occupation of Palestine,” the statement added. Israel has rejected global calls for a ceasefire saying the war would not stop until the Hamas group, whose October 7 attack triggered the current phase of the conflict, was destroyed. Some 1,200 people were killed in the Hamas attack in Israel. The Palestinian group has said its attack was against Israel’s 16-year-old blockade of Gaza and expansion of settlements in the occupied Palestinian territories. Settlement expansions pose the biggest hurdle in the realisation of a future Palestinian state comprising Gaza, occupied West Banka and East Jerusalem. In the latest development in Israel’s war on Gaza, tens of thousands of newly displaced Palestinians in the centre of the Palestinian enclave on Friday were forced to flee further south as Israel expanded its ground and air offensive in the centre of the enclave. Israel has faced global condemnation for the mounting toll and destruction and is accused of meting out collective punishment on the Palestinian people. The court application is the latest move by South Africa, a vociferous critic of Israel’s war, to ratchet up pressure after its lawmakers last month voted in favour of closing down the Israeli embassy in Pretoria and suspending all diplomatic relations until a ceasefire was agreed. Al Jazeera’s Gabriel Elizondo, reporting from the United Nations headquarters in New York, said the move was “clearly a very important step to try to hold some accountability to Israel.” “Now that South Africa is pushing this to the ICJ, it will be on [the UN’s] agenda to try to make a ruling on this very important question,” he added. On November 16, a group of 36 UN experts called on the international community to “prevent genocide against the Palestinian people”, calling Israel’s actions since October 7 a “genocide in the making”. “We are deeply disturbed by the failure of governments to heed our call and to achieve an immediate ceasefire. We are also profoundly concerned about the support of certain governments for Israel’s strategy of warfare against the besieged population of Gaza, and the failure of the international system to mobilise to prevent genocide,” the experts said in a statement. Israel has rejected South Africa’s move as “baseless”, calling it “blood libel.” “South Africa’s claim lacks both a factual and a legal basis, and constitutes despicable and contemptuous exploitation of the Court,” Israel’s minister of foreign affairs, Lior Haiat, said in a statement posted on X. “Israel has made it clear that the residents of the Gaza Strip are not the enemy, and is making every effort to limit harm to the non-involved and to allow humanitarian aid to enter the Gaza Strip,” the statement added. “It does rally public opinion to the reality of what’s going on in Palestine, not just in Gaza but also in the West Bank,” said Al Jazeera’s senior political analyst Marwan Bishara. According to Article 2 of the Genocide Convention, genocide involves acts committed with the “intent to destroy, either in whole or in part, a national, ethnic, racial, or religious group.” “Where the disagreement lies is whether there is intent or no intent,” Bishara said. “The three leading Israeli officials have declared the intent, starting with Israeli President Herzog when he said there are ‘no innocents’ in Gaza, the defence minister who said Israel will impose collective punishment on the people of Gaza because they are ‘human animals’,” Bishara said, adding that prime minister Netanyahu also used a biblical analogy in a statement widely interpreted as a genocidal call. The Palestinian ministry of foreign affairs welcomed South Africa’s move, and called on the ICJ to take immediate action to “prevent further harm to the Palestinian people”. “Israel’s stated policy, acts and omissions are genocidal in character are  committed with the requisite specific intent to the destruction of the Palestinian people under its colonial occupation and apartheid regime in violation of its obligations under the Genocide Convention,” a statement by the ministry said. “The State of Palestine appeals to the international community and the Contracting Parties to the Convention to uphold their obligations and support the Court in the proceedings.”   "
Yemen's Houthi rebels hijack cargo ship in Red Sea,Yemen’s Houthi rebels seize cargo ship in Red Sea,0.9077102987863368,2023-11-19,2023-11-19,"Yemen's Iranian-backed Houthi rebels say they have seized an Israeli cargo ship in the Red Sea.They said the vessel was then taken to a port in Yemen.Israel said the ship was not Israeli, and no Israelis were among its crew. Israeli PM Benjamin Netanyahu said this was ""another act of Iranian terrorism"". Iran has not commented. Houthis had threatened to hijack Israeli ship within their reach over Israel's war with Hamas in the Gaza Strip.Israel says 1,200 people were killed and more than 240 taken hostage during the surprise Hamas attack on the south of the country on 7 October.Israel has launched a massive military operation - involving air and artillery strikes as well as ground troops - with the aim of eliminating Hamas.The Hamas-run health ministry says the death toll in Gaza since then has reached 12,300. More than 2,000 more are feared to be buried under rubble.The Houthis have fired several missiles and drones towards Israel just after Israel launched its retaliatory operation.The US said at the time that all the missiles and drones were intercepted by its warship in the Red Sea.The Israel Defense Forces (IDF) described the attack on the ship - which it did not name - as a ""very grave incident of global consequence"".The IDF said the vessel was on its way from Turkey to India when it was seized in the southern Red Sea near Yemen.Although Israel says the seized vessel does not have any connection with it, unconfirmed reports suggest the ship may have an Israeli owner.In Sunday's statement on social media, Mr Netanyahu said that Israel ""strongly condemns the Iranian attack against an international vessel"".He said the ship was owned by ""a British company and is operated by a Japanese firm"", adding that ""25 crew members of various nationalities including Ukrainian, Bulgarian, Filipino and Mexican"" were on board the ship. Iranian Foreign Minister Hossein Amir-Abdollahian has recently said that what he called resistance groups allied to Tehran were ""cleverly adjusting pressure"" on Israel and its supporters.Earlier this month, the Houthis shot down a US military drone off Yemen's coast, American officials said.The Houthis have been locked in a prolonged civil war with Yemen's official government - backed by Saudi Arabia - since 2014. ","Yemen’s Houthis say they have taken control of a cargo ship in the southern Red Sea as thewar in Gazasends tensions soaring in the region. The Houthis, who control northern Yemen and its Red Sea coast, said the ship was Israeli, but Israel described it as a British-owned and Japanese-operated cargo vessel with no Israeli nationals on board. Some 25 people are believed to have been on board the Galaxy Leader – reported to be partly owned by an Israeli businessman and sailing under the flag of Bahamas – when it was seized en route from Turkey to India. Ownership details in public shipping databases associated the ship’s owners with Ray Car Carriers, founded by Abraham “Rami” Ungar, who is known as one of the richest men in Israel. Ungar told The Associated Press news agency he was aware of the incident but could not comment as he awaited details. A ship linked to himexperienced an explosionin 2021 in the Gulf of Oman. Israeli media blamed it on Iran at the time. International shipping often involves a series of management companies, flags and owners stretching across the globe in a single vessel. Houthi military spokesperson Yahya Saree said the seizure of the ship was in response to the “heinous acts against our Palestinian brothers in Gaza and the West Bank”. “If the international community is concerned about regional security and stability, rather than expanding the conflict, it should put an end to Israel’s aggression against Gaza,” he wrote on X. The Houthis have launched several missile and droneattacks against Israelsince October 7, when an attack by Hamas inside Israel prompted an Israeli ground and air offensive on Gaza. Last week, the Iran-aligned Houthis said they could target Israeli ships in the Red Sea and the Bab al-Mandeb Strait. Saree renewed the warning that any ship belonging to Israel or those who support it will be a legitimate target for Houthi forces. “We confirm our continuation of military operations against [Israel] until the aggression and ugly crimes against our Palestinian brothers in Gaza and the West Bank stop,” said Saree.    In a statement, Prime Minister Benjamin Netanyahu’s office said Israel was not involved in the ship’s ownership, operation or the makeup of its international crew. It alleged the attack was an “Iranian act of terrorism” with consequences for international maritime security. “This … represents an escalation in Iran’s belligerence against the citizens of the free world, with concomitant international ramifications vis-a-vis the security of global shipping routes,” said the statement released by the prime minister’s office, without providing any evidence about Iran’s involvement. “There were no Israelis on the ship,” it continued, adding the 25 crew members are from Ukraine, Mexico, the Philippines and Bulgaria, among other countries. On Monday, Iran denied the Israeli claims. Foreign Ministry spokesman Nasser Kanaani told reporters in Tehran that regional resistance groups make decisions and take actions based on their own interests.   "
