BBC_Title,Alj_Title,Similarity,BBC_date,Alj_date,BBC_text,Alj_text
Hamas deputy leader Saleh al-Arouri killed in Beirut blast,Senior Hamas official Saleh al-Arouri killed in Beirut suburb,0.6285428162191543,2024-01-03,2024-01-02,"Israel has insisted the assassination of a Hamas leader in Beirut was not an attack on Lebanon, as its enemies warned of ""punishment"" for his death.Israel has neither confirmed nor denied that it killed Saleh al-Arouri, but a spokesman called it a ""surgical strike against the Hamas leadership"".Hamas denounced it as a ""terrorist act"", while its ally Hezbollah said it was an assault on Lebanese sovereignty.Lebanon's PM accused Israel of trying to ""drag"" it into a regional war.Lebanese media report that Arouri, a deputy political leader of Hamas, was killed in a drone strike in southern Beirut on Tuesday along with six others - two Hamas military commanders and four other members.He was a key figure in the Izzedine al-Qassam Brigades, Hamas's armed wing, and a close ally of Ismail Haniyeh, the Hamas leader. He had been in Lebanon acting as a connection between his group and Hezbollah.There have been near daily exchanges of fire between Hezbollah and Israeli forces since the start of the war between Israel and Hamas in Gaza, but so far the violence has been limited to the area along the Israel-Lebanon border.Hezbollah - which, like Hamas, is considered a terrorist organisation by Israel, the UK and others - is the largest political and military force in Lebanon and has ministers in the country's government.The Israel Defense Forces (IDF) refused to comment on the assassination of Saleh al-Arouri, but said its troops were ""highly prepared for any scenario"".""The IDF is in a very high state of readiness in all arenas, in defence and offence,"" spokesman Rear Adm Daniel Hagari told a briefing.""The most important thing to say tonight is that we are focused and remain focused on fighting Hamas,"" he added.Israeli government adviser Mark Regev also stopped short of confirming Israel had carried out the attack, but he told MSNBC: ""Whoever did it, it must be clear that this was not an attack on the Lebanese state. ""It was not an attack even on Hezbollah, the terrorist organisation. ""Whoever did this did a surgical strike against the Hamas leadership. Whoever did this has a gripe with Hamas. That is very clear.""Arouri, 57, is the most senior Hamas figure to be killed since Israel went to war with the group after its 7 October attack.On that day, waves of Hamas gunmen invaded Israel and attacked communities around the border, killing about 1,200 people, mostly civilians, and taking around 240 to Gaza as hostages. Israel launched a military offensive in response, with the declared aim of destroying Hamas. Since then, more than 22,000 Palestinians - mostly women and children - have been killed in Israeli strikes on Gaza, according to Gaza's Hamas-run health ministry.Lebanon's state news agency said Arouri had been killed by an Israeli drone attack on a Hamas office in the southern Beirut suburb of Dahiyeh.A witness from Reuters news agency saw firefighters and paramedics gathered around a high-rise building where there was a large hole in what appeared to be the third floor.Video footage on social media showed a car in flames and extensive damage to buildings in what is a busy residential area.Dahiyeh is known as a stronghold of Hezbollah.Mr Haniyeh, the leader of Hamas's political bureau, called the attack a ""cowardly... terrorist act, a violation of Lebanon's sovereignty, and an expansion of its circle of aggression"".Hezbollah said that it considered Arouri's death ""to be a serious assault on Lebanon, its people, its security, sovereignty, and resistance, and the highly symbolic and significant political and security messages it contains"".It said the attack was ""a dangerous development in the course of the war... and we in Hezbollah affirm that this crime will never pass without response and punishment"". ""Its hand is on the trigger, and its resistors are in the highest levels of readiness and preparedness,"" it added.Iran, a major supporter of both groups, said Arouri's killing would ""undoubtedly ignite another surge in the veins of resistance"".An Israeli security cabinet meeting scheduled for Tuesday evening to discuss the post-war plan for Gaza was cancelled.The Lebanese Foreign Minister, Abdallah Bou Habib, told BBC Radio 4 his government was talking to Hezbollah to ""impress on them that they should not respond themselves"" but that: ""We don't tell them, we dialogue with them in this regard.""Over the next 24 hours it will become clear ""whether they respond or not"", he said, adding: ""We are very concerned, [the] Lebanese don't want to be dragged, even Hezbollah does not want to be dragged into a regional war."" And he called on the West to ""pressure Israel to stop also all its violence and all of its actions, not only on Lebanon, not only on Beirut, but also in Gaza"".Israeli Prime Minister Benjamin Netanyahu has previously vowed to eliminate Hamas's leaders, wherever they are.Arouri was also considered the de facto leader of Hamas's military wing in the West Bank, overseeing attacks there, according to Israeli media reports.He is believed to have been involved in the kidnapping and killing of three Israeli teenagers in the occupied West Bank in 2014, reports say, and had served time in Israeli jails for other attacks.The Times of Israel says he was also one of the Hamas officials most closely connected to Iran and Hezbollah.","Senior Hamas official Saleh al-Arouri has been killed in an Israeli drone strike on Beirut’s southern suburb of Dahiyeh, the Palestinian group and Lebanese media outlets say. Al-Arouri was killed on Tuesday in a “treacherous Zionist strike”, Hamas said on its official channel. Hamas politburo member Izzat al-Sharq called it a “cowardly assassination”. Al-Arouri was a senior official in Hamas’s politburo and was known to be deeply involved in its military affairs. He had previously headed the group’s presence in the occupied West Bank. Samir Findi Abu Amer and Azzam Al-Aqraa Abu Ammar, leaders of Hamas’ armed wing – the Qassam Brigades – were also killed, Hamas said in a message on its Telegram channel. It named four other members of the group who were also killed. Earlier, Lebanon’s state-run National News Agency said the blast killed at least six people and that it was carried out by an Israeli drone. Hamas said al-Arouri’s killing would not “undermine the continued brave resistance” in Gaza, where the Palestinian group’s fighters are battling Israeli ground forces. “It proves once more the utter failure of the enemy to achieve any of its aggressive goals in the Gaza Strip,” senior Hamas official Izzat al-Rishq said in a statement. The group’s top leader Ismail Haniyeh condemned the attack as a “terrorist act”, a violation of Lebanon’s sovereignty, and an expansion of Israel’s circle of hostility against Palestinians. Haniyeh said in televised remarks that Hamas “will never be defeated”. There was no immediate comment from Israel. Mark Regev, an adviser to Israeli Prime Minister Benjamin Netanyahu, told the United States news channel MSNBC that Israel had not taken responsibility for the attack but “whoever did it, it must be clear that this was not an attack on the Lebanese state”. “Whoever did this did a surgical strike against the Hamas leadership,” Regev said in an interview. Lebanese Prime Minister Najib Mikati condemned the killing. His office said in a statement that the attack “aims to draw Lebanon into a new phase of confrontations” with Israel at a time when Hamas ally Hezbollah has been exchanging daily cross-border fire with Israeli forces in northern Israel, the statement said. Al Jazeera’s Zeina Khodr, reporting from Beirut, said there was “panic” in the Lebanese capital after the attack. “The targeted killing made many people here in the capital feel that this conflict could widen and could escalate, and all eyes are now on Hezbollah’s reaction,” Khodr said. Iran, which supports both Hamas and Hezbollah, said al-Arouri’s killing would create more resistance against Israel, its state media reported. “The martyr’s blood will undoubtedly ignite another surge in the veins of resistance and the motivation to fight against the Zionist occupiers not only in Palestine but also in the region and among all freedom seekers worldwide,” Iranian Ministry of Foreign Affairs spokesperson Nasser Kanaani said. Kanaani also condemned the violation of Lebanon’s sovereignty and territorial integrity. Netanyahu had threatened to kill al-Arouri long before Israel’s latest assault on the besieged Gaza Strip. Israeli political analyst Akiva Eldar told Al Jazeera the killing was a much needed success for Netanyahu.    Imad Harb, director of research at the Arab Center Washington DC, agreed, saying Israel carried out the attack in search for what has become an elusive win. “So far, the Israelis have not been able to call a victory in Gaza, so assassinating Hamas leaders is partly something that they wanted to do anyway,” he told Al Jazeera. “This is an achievement for the Israeli army and for the Israeli politicians.” Since Israeli forces and Hezbollah began exchanging fire across the Lebanese-Israeli border on October 8, the fighting has largely been concentrated a few kilometres inside each country. But on several occasions, Israel’s air force has hit what it said were Hezbollah positions deeper inside Lebanon. Harb said the killing of al-Arouri is a “dangerous escalation” because it took place in Hezbollah’s area of operations, far from the border. Harb predicted Hezbollah would likely step up attacks on Israel in response to the killing but would stop short of escalating the conflict into an all-out war. Meanwhile, at mosques in Arura, the hometown of the slain Hamas leader in the West Bank, Palestinians gathered to mourn al-Arouri’s death. Protests and gatherings also took place in Ramallah and several nearby towns, such as Deir Qaddis. A general strike in Ramallah has also been called for Wednesday."
UN: Thousands in Gaza break into warehouses in search of aid,"Palestinians break into Gaza UN aid warehouses as toll tops 8,000",0.6188130039620288,2023-10-29,2023-10-29,"Thousands of people in Gaza have broken into aid depots to take supplies in what the UN called a ""worrying sign of civil order starting to break down"".The UN relief agency for Palestinians (Unrwa) said warehouses holding basics like flour and soap were ransacked.The news comes as Israel intensifies military action against Hamas in Gaza.More than half of the Strip's 2.4 million inhabitants have been displaced and thousands of buildings have been destroyed, the UN says.Hamas gunmen launched unprecedented attacks on Israel from Gaza on 7 October, killing more than 1,400 people and taking 230 hostages.Since then, Israel has been carrying out strikes and now ground operations in Gaza, where the Hamas-run Palestinian health ministry says more than 8,000 people have been killed.Unwra said its second largest depot - located in Deir al-Balah, in the central Gaza Strip - was targeted on Saturday as it holds most of the humanitarian aid delivered by the UN.People took flour, wheat and hygiene kits after storming this and several other storage facilities in the centre and south of Gaza, the agency said.A senior spokeswoman for the UN World Food Programme (WFP), Abeer Etefa, told the BBC that the raids on warehouses were ""expected"" because of the ""difficult conditions facing people"".""The bottom line is that people are desperate, they are hungry,"" she said. Some of the displaced Gazans who took items from the UN warehouses told AFP news agency they had ""no flour, no aid, no water, not even toilets"".  Gaza resident Abdulrahman al-Kilani said: ""Our houses were destroyed. No one cares about us. We appeal to the people of the world. All international powers are against us. We needed aid, and we wouldn't have done this if we weren't in need.""Very little aid, and no fuel, has been allowed to enter Gaza since the attack by Hamas. Israel says it is concerned that supplies will be used by Hamas to continue the conflict.But officials on Sunday indicated that Israel would allow more aid into the strip in the coming days.In a video statement posted on social media, Israel Defense Forces (IDF) spokesman Rear Admiral Daniel Hagari said humanitarian aid from Egypt and the US would be expanded into Gaza on Sunday, without elaborating further on the details.However spokesman for Egypt's foreign ministry, Ahmed Abu Zeid, accused Israel of ""obstructing"" aid deliveries by implementing cumbersome security checks.Meanwhile,  UN Secretary-General AntÃ³nio Guterres said the situation in Gaza was growing more desperate by the hour.""More than two million people, with nowhere safe to go, are being denied the essentials for life - food, water, shelter and medical care - while being subjected to relentless bombardment. I urge all those with responsibility to step back from the brink,"" the UN chief said.","The United Nations relief agency says thousands of Palestinians, desperate due to three weeks of total siege and bombing, broke into several of its warehouses in the Gaza Strip, taking wheat, flour and other basic goods. “This is a worrying sign that civil order is starting to break down after three weeks of war and a tight siege,” said Thomas White, director of the UN Relief and Works Agency for Palestine Refugees (UNRWA) in Gaza. UN Secretary-General Antonio Guterres on Sunday repeated appeals to end the bloodshed and agree on a ceasefire to end the “nightmare”. “The situation in Gaza is growing more desperate by the hour. I regret that instead of a critically needed humanitarian pause, supported by the international community, Israel has intensified its military operations,” Guterres said. Israel imposed a total siege – no food, water, electricity – on the Palestinian enclave of 2.3 million people in the wake of the Hamas attack in Israel. Israel has allowed limited supplies of basic necessities and medicines. Efforts are under way to get more supply of food, water, fuel and medicine in the enclave that has been under intense bombing since October 7. Gaza’s Health Ministry said the death toll among Palestinians has crossed 8,000 – most of them women and minors – as Israeli Prime Minister Benjamin Netanyahu announced a “second stage” in the war after tanks and infantry pushed into Gaza over the weekend. The bombardment over the weekend – described by Gaza residents as the most intense of the war – knocked out communications in the territory late on Friday, largely cutting off the besieged enclave’s 2.3 million people from the world. Communications were restored to much of Gaza early on Sunday. The Israeli military said on Sunday it had struck more than 450 targets over the past 24 hours, including Hamas command centres, observation posts and antitank missile launching positions. It said more ground forces were sent into Gaza overnight.    UNRWA provides necessities in Gaza, and many of the displaced Palestinians are sheltering in UNRWA schools. Several hospitals have shut down and others are on the verge of closing down due to a lack of fuel. “Supplies on the market are running out while the humanitarian aid coming into the Gaza Strip on trucks from Egypt is insufficient,” UNRWA said. “The needs of the communities are immense, if only for basic survival, while the aid we receive is meagre and inconsistent.” Juliette Touma, a spokesperson for the agency, said the crowds broke into a total of four facilities on Saturday. She said the warehouses did not contain any fuel, which has been in critically short supply since Israel cut off all shipments after the start of the war. One of the warehouses pillaged is located in Deir el-Balah, where UNRWA stores supplies from the humanitarian convoys crossing into Gaza from Egypt. White, the UNRWA chief, said the massive displacement of people has placed enormous pressure on the host communities. “Some families,” he said, “received up to 50 relatives taking shelter in one household.”    “The current system of convoys is geared to fail. Very few trucks, slow processes, strict inspections, supplies that do not match the requirements of UNRWA and the other aid organisations, and mostly the ongoing ban on fuel, are all a recipe for a failed system,” he added. UNRWA has said its ability to help people in Gaza has been completely stretched by air raids that have killed more than 50 of its staff and restricted the movement of supplies. More than613,000of 1.4 million internally displaced people in Gaza are sheltering in 150 UNRWA facilities across the blockaded territory. But severe overcrowding, a lack of privacy and inadequate sanitation have put these schools at risk of a prolonged and severe public health crisis, adding pressure to the already overloaded healthcare system which doctors and the Ministry of Health describe as being in a state of total collapse. The UN agency said some shelters are currently hosting 10 to 12 times more people than their capacity."
Al-Shifa: What we know about Israel's raid on Gaza's main hospital,Israel’s raid on Gaza’s al-Shifa Hospital: Here’s what you need to know,0.6158183481851943,2023-11-15,2023-11-15,"The Israeli military has raided Gaza's main hospital in what it describes as a ""targeted operation against Hamas"".An eyewitness at Al-Shifa hospital told the BBC that troops moved in overnight and were interrogating people. On Wednesday, Israel said it found Hamas' ""operational centre"" at the hospital, sharing images of what it said were Hamas weapons and equipment.Hamas denies operating there and the BBC cannot independently verify claims by either side.UN humanitarian chief Martin Griffiths said he was ""appalled"" by the Israeli raid, while the World Health Organization (WHO) said it was ""extremely worried"" for patients and staff, with whom it had lost contact.The BBC has been speaking to a journalist and a doctor inside the hospital to find out what is happening there, while the Israel Defense Forces (IDF) has also been providing updates. Khader, a journalist inside Al-Shifa, told the BBC's Rushdi Abualouf that Israeli troops were in ""complete control"" of the hospital and no shooting was taking place.He said six tanks and about 100 commandos entered the complex during the night. The Israeli forces then went room to room, questioning staff and patients.The IDF reportedly asked all men aged 16-40 to leave the hospital buildings, except the surgical and emergency departments, and go to the hospital courtyard.Soldiers fired into the air to force those remaining inside to come out, Khader said.However Muhammad Zaqout, the Hamas-run Gaza health ministry's director of hospitals, told Al Jazeera that ""not a single bullet"" had been fired - because ""there are no resistors or detainees"" inside.Early on Wednesday, the IDF said its forces were in the midst of a ""precise and targeted operation against Hamas in a specified area"" in the hospital.It said the raid was ""based on intelligence information and an operational necessity"", calling for the surrender of ""all Hamas terrorists"" present there.As the soldiers entered the hospital complex, they engaged with a number Hamas members and killed them, the IDF said.On Wednesday evening, the IDF said troops found ""an operational command centre, weapons, and technological assets"" belonging to Hamas inside the MRI building.It said it was ""continuing to operate in the hospital complex"", sharing images and videos showing what it said were Hamas weapons.In a seven-minute video, IDF spokesperson Jonathan Conricus pointed to security cameras that he said had been covered over, and weapons that he said were AK47 rifles hidden behind MRI scanners.The BBC has not yet been able to verify the video or its location.But unless Israel has more to reveal, the military's controversial operation inside the hospital did not net a major arsenal of weapons, reports the BBC's Orla Guerin in Jerusalem.Hamas knew Israel was coming, and therefore, if they were operating beneath the hospital, they would have had weeks to clear out through Gaza's extensive tunnel network, our correspondent adds.Israel's Army Radio reported that troops had not yet found any sign of any of the 240 hostages taken by Hamas during the 7 October attack on Israel, when 1,200 other people were killed.The raid on Al-Shifa came shortly after the US publicly backed Israeli claims that Hamas had infrastructure underneath the hospital. However Dr Ahmed Mokhallalati, a plastic surgeon at Al-Shifa, told the BBC there were only civilians in the hospital.He said there were tunnels under every building in Gaza, including Al-Shifa hospital.According to international humanitarian law, hospitals are specially protected facilities.This means that parties to conflicts cannot attack hospitals, or prevent them performing their medical functions. They can lose their protection if they are used by a party to the conflict to commit an ""act harmful to the enemy"". The International Committee of the Red Cross (ICRC) says this could be something like a hospital being used as a base from which to launch an attack, as a shelter for able-bodied fighters, or to shield a military objective from attack.The IDF said it had repeatedly warned Hamas its ""continued military use of Al-Shifa jeopardises its protected status"", calling for the evacuation of the hospital before the raid.The WHO had warned that evacuating patients would be a ""death sentence"", given that the medical system was collapsing.Dr Mokhallalati told the BBC on Wednesday the hospital was without power, oxygen and water. On Tuesday, surgeries had been carried out without proper anaesthesia, with patients ""screaming in pain"". Doctors were unable to help one patient with burns, and had to just ""let him die"".Dr Mokhallalati said  six premature babies had died in recent days.""Why can't they be evacuated,"" he said. ""In Afghanistan, they evacuated the cats and dogs.""The IDF said it was providing incubators, baby food and medical supplies.","Israeli forcesraidedGaza’sal-Shifa Hospital on Wednesdayafter laying siege of the enclave’s largest medical facility for days. Thousands of people are trapped inside, with decomposed dead bodies buried in a mass grave on the hospital premises. Here is what to know:          "
